Sheet: ttf
A1: bhasa | B1: font | C1: t1 | D1: t2 | E1: t3
A2: Tmil | B2: tmil54muktamalar | C2: abcdefghijklmnopqrstuvwxyz | D2: ABCDEFGHIJKLMNOPQRSTUVWXYZ | E2: AAaaiueoNHfyrlvmnkkhgghcchzzhtthddhTThDDhpphfbbhssh
A3: Tmil | B3: tmil54 | C3: abcdefghijklmnopqrstuvwxyz | D3: ABCDEFGHIJKLMNOPQRSTUVWXYZ | E3: AAaaiueoNHfyrlvmnkkhgghcchzzhtthddhTThDDhpphfbbhssh
A4: Tmil | B4: tmil54notosans | C4: abcdefghijklmnopqrstuvwxyz | D4: ABCDEFGHIJKLMNOPQRSTUVWXYZ | E4: AAaaiueoNHfyrlvmnkkhgghcchzzhtthddhTThDDhpphfbbhssh
A5: Tmil | B5: tmil58muktamalar | C5: abcdefghijklmnopqrstuvwxyz | D5: ABCDEFGHIJKLMNOPQRSTUVWXYZ | E5: AAaaiueoNHfyrlvmnkkhgghcchzzhtthddhTThDDhpphfbbhssh
A6: Tmil | B6: tmil58 | C6: abcdefghijklmnopqrstuvwxyz | D6: ABCDEFGHIJKLMNOPQRSTUVWXYZ | E6: AAaaiueoNHfyrlvmnkkhgghcchzzhtthddhTThDDhpphfbbhssh
A7: Tmil | B7: tmil58notosans | C7: abcdefghijklmnopqrstuvwxyz | D7: ABCDEFGHIJKLMNOPQRSTUVWXYZ | E7: AAaaiueoNHfyrlvmnkkhgghcchzzhtthddhTThDDhpphfbbhssh
A8: telugu | B8: telugu54baloo | C8: abcdefghijklmnopqrstuvwxyz | D8: ABCDEFGHILJKLKMNOPQRSTUVWXYZ | E8: AAaaiueoNHfyrlvmnkkhgghcchzzhtthddhTThDDhpphfbbhssh
A9: telugu | B9: telugu54baloo | C9: abcdefghijklmnopqrstuvwxyz | D9: ABCDEFGHILJKLKMNOPQRSTUVWXYZ | E9: AAaaiueoNHfyrlvmnkkhgghcchzzhtthddhTThDDhpphfbbhssh
A10: telugu | B10: telugu54 | C10: abcdefghijklmnopqrstuvwxyz | D10: ABCDEFGHIJKLMNOPQRSTUVWXYZ | E10: AAaaiueoNHfyrlvmnkkhgghcchzzhtthddhTThDDhpphfbbhssh
A11: telugu | B11: telugu58 | C11: abcdefghijklmnopqrstuvwxyz | D11: ABCDEFGHIJKLMNOPQRSTUVWXYZ | E11: AAaaiueoNHfyrlvmnkkhgghcchzzhtthddhTThDDhpphfbbhssh
A12: pnzabi | B12: pnzabi54 | C12: abcdefghijklmnopqrstuvwxyz | D12: ABCDEFGHIJKLMNOPQRSTUVWXYZ | E12: AAaaiueoNHfyrlvmnkkhgghcchzzhtthddhTThDDhpphfbbhssh
A13: pnzabi | B13: pnzabi54mukta | C13: abcdefghijklmnopqrstuvwxyz | D13: ABCDEFGHIJKLMNOPQRSTUVWXYZ | E13: AAaaiueoNHfyrlvmnkkhgghcchzzhtthddhTThDDhpphfbbhssh
A14: pnzabi | B14: pnzabi58 | C14: abcdefghijklmnopqrstuvwxyz | D14: ABCDEFGHIJKLMNOPQRSTUVWXYZ | E14: AAaaiueoNHfyrlvmnkkhgghcchzzhtthddhTThDDhpphfbbhssh
A15: pnzabi | B15: pnzabi58mukta | C15: abcdefghijklmnopqrstuvwxyz | D15: ABCDEFGHIJKLMNOPQRSTUVWXYZ | E15: AAaaiueoNHfyrlvmnkkhgghcchzzhtthddhTThDDhpphfbbhssh
A16: kannada | B16: kannada58 | C16: abcdefghijklmnopqrstuvwxyz | D16: ABCDEFGHIJKLMNOPQRSTUVWXYZ | E16: AAaaiueoNHfyrlvmnkkhgghcchzzhtthddhTThDDhpphfbbhssh
A17: kannada | B17: kannada58notosans | C17: abcdefghijklmnopqrstuvwxyz | D17: ABCDEFGHIJKLMNOPQRSTUVWXYZ | E17: AAaaiueoNHfyrlvmnkkhgghcchzzhtthddhTThDDhpphfbbhssh
A18: kannada | B18: kannada54 | C18: abcdefghijklmnopqrstuvwxyz | D18: ABCDEFGHIJKLMNOPQRSTUVWXYZ | E18: AAaaiueoNHfyrlvmnkkhgghcchzzhtthddhTThDDhpphfbbhssh
A19: kannada | B19: kannada54notosans | C19: abcdefghijklmnopqrstuvwxyz | D19: ABCDEFGHIJKLMNOPQRSTUVWXYZ | E19: AAaaiueoNHfyrlvmnkkhgghcchzzhtthddhTThDDhpphfbbhssh
A20: mlyalm | B20: mlyalm54 | C20: abcdefghijklmnopqrstuvwxyz | D20: ABCDEFGHIJKLMNOPQRSTUVWXYZ | E20: AAaaiueoNHfyrlvmnkkhgghcchzzhtthddhTThDDhpphfbbhssh
A21: mlyalm | B21: mlyalm54notosans | C21: abcdefghijklmnopqrstuvwxyz | D21: ABCDEFGHIJKLMNOPQRSTUVWXYZ | E21: AAaaiueoNHfyrlvmnkkhgghcchzzhtthddhTThDDhpphfbbhssh
A22: mlyalm | B22: mlyalm58 | C22: abcdefghijklmnopqrstuvwxyz | D22: ABCDEFGHIJKLMNOPQRSTUVWXYZ | E22: AAaaiueoNHfyrlvmnkkhgghcchzzhtthddhTThDDhpphfbbhssh
A23: mlyalm | B23: mlyalm58notosans | C23: abcdefghijklmnopqrstuvwxyz | D23: ABCDEFGHIJKLMNOPQRSTUVWXYZ | E23: AAaaiueoNHfyrlvmnkkhgghcchzzhtthddhTThDDhpphfbbhssh
A24: odia | B24: odia54 | C24: abcdefghijklmnopqrstuvwxyz | D24: ABCDEFGHIJKLMNOPQRSTUVWXYZ | E24: AAaaiueoNHfyrlvmnkkhgghcchzzhtthddhTThDDhpphfbbhssh
A25: odia | B25: odia58 | C25: abcdefghijklmnopqrstuvwxyz | D25: ABCDEFGHIJKLMNOPQRSTUVWXYZ | E25: AAaaiueoNHfyrlvmnkkhgghcchzzhtthddhTThDDhpphfbbhssh
A26: guzraTi | B26: guz54 | C26: abcdefghijklmnopqrstuvwxyz | D26: ABCDEFGHIJKLMNOPQRSTUVWXYZ | E26: AAaaiueoNHfyrlvmnkkhgghcchzzhtthddhTThDDhpphfbbhssh
A27: guzraTi | B27: guz58 | C27: abcdefghijklmnopqrstuvwxyz | D27: ABCDEFGHIJKLMNOPQRSTUVWXYZ | E27: AAaaiueoNHfyrlvmnkkhgghcchzzhtthddhTThDDhpphfbbhssh
A28: baNgla | B28: bangla54 | C28: abcdefghijklmnopqrstuvwxyz | D28: ABCDEFGHIJKLMNOPQRSTUVWXYZ | E28: AAaaiueoNHfyrlvmnkkhgghcchzzhtthddhTThDDhpphfbbhssh
A29: baNgla | B29: bangla58 | C29: abcdefghijklmnopqrstuvwxyz rs | D29: ABCDEFGHIJKLMNOPQRSTUVWXYZ | E29: AAaaiueoNHfyrlvmnkkhgghcchzzhtthddhTThDDhpphfbbhssh
A30: hinDi | B30: hin54 | C30: abcdefghijklmnopqrstuvwxyz | D30: ABCDEFGHIJKLMNOPQRSTUVWXYZ | E30: AAaaiueoNHfyrlvmnkkhgghcchzzhtthddhTThDDhpphfbbhssh
A31: hinDi | B31: hin54notosans | C31: abcdefghijklmnopqrstuvwxyz | D31: ABCDEFGHIJKLMNOPQRSTUVWXYZ | E31: AAaaiueoNHfyrlvmnkkhgghcchzzhtthddhTThDDhpphfbbhssh
A32: hinDi | B32: hin58 | C32: abcdefghijklmnopqrstuvwxyz | D32: ABCDEFGHIJKLMNOPQRSTUVWXYZ | E32: AAaaiueoNHfyrlvmnkkhgghcchzzhtthddhTThDDhpphfbbhssh
A33: hinDi | B33: hin58notosans | C33: abcdefghijklmnopqrstuvwxyz rs | D33: ABCDEFGHIJKLMNOPQRSTUVWXYZ | E33: AAaaiueoNHfyrlvmnkkhgghcchzzhtthddhTThDDhpphfbbhssh

Sheet: easyl
A1: AA D aiueohcg rr nn kk TT tt pp yy mm ll vv HH zz ss N*bdf | B1: Aa Ak ka ki ku ke ko kN kh Th th ph zh sh kha khi khu khe | C1: ll AA TT Telugu58/54 rr kk DD bb zz dd tt zava8.github.io aiueohcg yy mm vv HH nn ss pp ff N | D1: ll AA TT kannada58/54 rr kk DD bb zz dd tt zava8.github.io aiueohcg yy mm vv HH nn ss pp ff N
C2: Aa Ak ka ki ku ke ko kN kh Th th ph zh sh ph kha khi khu khe dh | D2: Aa Ak ka ki ku ke ko kN kh Th th ph zh sh ph kha khi khu khe dh

Sheet: 2tebl
A1: 1 | B1: of:=[.A1] -> 1 | C1: 2*1=2 | D1: tu vnza tu | E1: of:=[.D1] -> tu vnza tu
A2: 2 | B2: of:=[.A2] -> 2 | C2: 2*2=4 | D2: tu tuza phor | E2: of:=[.D2] -> tu tuza phor
A3: 3 | B3: of:=[.A3] -> 3 | C3: 2*3=6 | D3: tu Thriza siks | E3: of:=[.D3] -> tu Thriza siks
A4: 4 | B4: of:=[.A4] -> 4 | C4: 2*4=8 | D4: tu phorza et | E4: of:=[.D4] -> tu phorza et
A5: 5 | B5: of:=[.A5] -> 5 | C5: 2*5=L | D5: tu phaivza ten | E5: of:=[.D5] -> tu phaivza ten
A6: 6 | B6: of:=[.A6] -> 6 | C6: 2*6=Q | D6: tu siksza kvelv | E6: of:=[.D6] -> tu siksza kvelv
A7: 7 | B7: of:=[.A7] -> 7 | C7: 2*7=X | D7: tu sevenza Aksen | E7: of:=[.D7] -> tu sevenza Aksen
A8: 8 | B8: of:=[.A8] -> 8 | C8: 2*8=10 | D8: tu etza vnti | E8: of:=[.D8] -> tu etza vnti
A9: 9 | B9: of:=[.A9] -> 9 | C9: 2*9=12 | D9: tu nainza vnti tu | E9: of:=[.D9] -> tu nainza vnti tu
A10: L | B10: of:=[.A10] -> L | C10: 2*L=14 | D10: tu tenza vnti phor | E10: of:=[.D10] -> tu tenza vnti phor
A11: J | B11: of:=[.A11] -> J | C11: 2*J=16 | D11: tu zilevenza vnti siks | E11: of:=[.D11] -> tu zilevenza vnti siks
A12: Q | B12: of:=[.A12] -> Q | C12: 2*Q=18 | D12: tu kvelvza vnti et | E12: of:=[.D12] -> tu kvelvza vnti et
A13: W | B13: of:=[.A13] -> W | C13: 2*W=1L | D13: tu dblunza vnti ten | E13: of:=[.D13] -> tu dblunza vnti ten
A14: X | B14: of:=[.A14] -> X | C14: 2*X=1Q | D14: tu Aksenza vnti kvelv | E14: of:=[.D14] -> tu Aksenza vnti kvelv
A15: F | B15: of:=[.A15] -> F | C15: 2*F=1X | D15: tu phenza vnti Aksen | E15: of:=[.D15] -> tu phenza vnti Aksen
A16: 10 | B16: of:=[.A16] -> 10 | C16: 2*10=20 | D16: tu vntiza tuti | E16: of:=[.D16] -> tu vntiza tuti

Sheet: 3tebl
A1: 1 | B1: of:=[.C1] -> vn | C1: vn | D1: of:=[.A1] -> 1 | E1: 3*1=3 | F1: of:=[.E1] -> 3*1=3 | G1: of:=[.H1] -> Thri vnza Thri | H1: Thri vnza Thri
A2: 2 | B2: of:=[.C2] -> tu | C2: tu | D2: of:=[.A2] -> 2 | E2: 3*2=6 | F2: of:=[.E2] -> 3*2=6 | G2: of:=[.H2] -> Thri tuza siks | H2: Thri tuza siks
A3: 3 | B3: of:=[.C3] -> Thri | C3: Thri | D3: of:=[.A3] -> 3 | E3: 3*3=9 | F3: of:=[.E3] -> 3*3=9 | G3: of:=[.H3] -> Thri Thriza nain | H3: Thri Thriza nain
A4: 4 | B4: of:=[.C4] -> phor | C4: phor | D4: of:=[.A4] -> 4 | E4: 3*4=Q | F4: of:=[.E4] -> 3*4=Q | G4: of:=[.H4] -> Thri phorza kvelv | H4: Thri phorza kvelv
A5: 5 | B5: of:=[.C5] -> phaiv | C5: phaiv | D5: of:=[.A5] -> 5 | E5: 3*5=F | F5: of:=[.E5] -> 3*5=F | G5: of:=[.H5] -> Thri phaivza phen | H5: Thri phaivza phen
A6: 6 | B6: of:=[.C6] -> siks | C6: siks | D6: of:=[.A6] -> 6 | E6: 3*6=12 | F6: of:=[.E6] -> 3*6=12 | G6: of:=[.H6] -> Thri siksza vnti tu | H6: Thri siksza vnti tu
A7: 7 | B7: of:=[.C7] -> seven | C7: seven | D7: of:=[.A7] -> 7 | E7: 3*7=15 | F7: of:=[.E7] -> 3*7=15 | G7: of:=[.H7] -> Thri sevenza vnti phaiv | H7: Thri sevenza vnti phaiv
A8: 8 | B8: of:=[.C8] -> et | C8: et | D8: of:=[.A8] -> 8 | E8: 3*8=18 | F8: of:=[.E8] -> 3*8=18 | G8: of:=[.H8] -> Thri etza vnti et | H8: Thri etza vnti et
A9: 9 | B9: of:=[.C9] -> nain | C9: nain | D9: of:=[.A9] -> 9 | E9: 3*9=1J | F9: of:=[.E9] -> 3*9=1J | G9: of:=[.H9] -> Thri nainza vnti zileven | H9: Thri nainza vnti zileven
A10: L | B10: of:=[.C10] -> ten | C10: ten | D10: of:=[.A10] -> L | E10: 3*L=1X | F10: of:=[.E10] -> 3*L=1X | G10: of:=[.H10] -> Thri tenza vnti Aksen | H10: Thri tenza vnti Aksen
A11: J | B11: of:=[.C11] -> zileven | C11: zileven | D11: of:=[.A11] -> J | E11: 3*J=21 | F11: of:=[.E11] -> 3*J=21 | G11: of:=[.H11] -> Thri zilevenza tuti vn | H11: Thri zilevenza tuti vn
A12: Q | B12: of:=[.C12] -> kvelv | C12: kvelv | D12: of:=[.A12] -> Q | E12: 3*Q=24 | F12: of:=[.E12] -> 3*Q=24 | G12: of:=[.H12] -> Thri kvelvza tuti phor | H12: Thri kvelvza tuti phor
A13: W | B13: of:=[.C13] -> dblun | C13: dblun | D13: of:=[.A13] -> W | E13: 3*W=27 | F13: of:=[.E13] -> 3*W=27 | G13: of:=[.H13] -> Thri dblunza tuti seven | H13: Thri dblunza tuti seven
A14: X | B14: of:=[.C14] -> Aksen | C14: Aksen | D14: of:=[.A14] -> X | E14: 3*X=2L | F14: of:=[.E14] -> 3*X=2L | G14: of:=[.H14] -> Thri Aksenza tuti ten | H14: Thri Aksenza tuti ten
A15: F | B15: of:=[.C15] -> phen | C15: phen | D15: of:=[.A15] -> F | E15: 3*F=2W | F15: of:=[.E15] -> 3*F=2W | G15: of:=[.H15] -> Thri phenza tuti dblun | H15: Thri phenza tuti dblun
A16: 10 | B16: of:=[.C16] -> vnti | C16: vnti | D16: of:=[.A16] -> 10 | E16: 3*10=30 | F16: of:=[.E16] -> 3*10=30 | G16: of:=[.H16] -> Thri vntiza Thriti | H16: Thri vntiza Thriti

Sheet: 4tebl
A1: 1 | B1: of:=[.C1] -> vn | C1: vn | D1: of:=[.A1] -> 1 | E1: 4*1=4 | F1: of:=[.E1] -> 4*1=4 | G1: of:=[.H1] -> phor vnza phor | H1: phor vnza phor
A2: 2 | B2: of:=[.C2] -> tu | C2: tu | D2: of:=[.A2] -> 2 | E2: 4*2=8 | F2: of:=[.E2] -> 4*2=8 | G2: of:=[.H2] -> phor tuza et | H2: phor tuza et
A3: 3 | B3: of:=[.C3] -> Thri | C3: Thri | D3: of:=[.A3] -> 3 | E3: 4*3=Q | F3: of:=[.E3] -> 4*3=Q | G3: of:=[.H3] -> phor Thriza kvelv | H3: phor Thriza kvelv
A4: 4 | B4: of:=[.C4] -> phor | C4: phor | D4: of:=[.A4] -> 4 | E4: 4*4=10 | F4: of:=[.E4] -> 4*4=10 | G4: of:=[.H4] -> phor phorza vnti | H4: phor phorza vnti
A5: 5 | B5: of:=[.C5] -> phaiv | C5: phaiv | D5: of:=[.A5] -> 5 | E5: 4*5=14 | F5: of:=[.E5] -> 4*5=14 | G5: of:=[.H5] -> phor phaivza vnti phor | H5: phor phaivza vnti phor
A6: 6 | B6: of:=[.C6] -> siks | C6: siks | D6: of:=[.A6] -> 6 | E6: 4*6=18 | F6: of:=[.E6] -> 4*6=18 | G6: of:=[.H6] -> phor siksza vnti et | H6: phor siksza vnti et
A7: 7 | B7: of:=[.C7] -> seven | C7: seven | D7: of:=[.A7] -> 7 | E7: 4*7=1Q | F7: of:=[.E7] -> 4*7=1Q | G7: of:=[.H7] -> phor sevenza vnti kvelv | H7: phor sevenza vnti kvelv
A8: 8 | B8: of:=[.C8] -> et | C8: et | D8: of:=[.A8] -> 8 | E8: 4*8=20 | F8: of:=[.E8] -> 4*8=20 | G8: of:=[.H8] -> phor etza tuti | H8: phor etza tuti
A9: 9 | B9: of:=[.C9] -> nain | C9: nain | D9: of:=[.A9] -> 9 | E9: 4*9=24 | F9: of:=[.E9] -> 4*9=24 | G9: of:=[.H9] -> phor nainza tuti phor | H9: phor nainza tuti phor
A10: L | B10: of:=[.C10] -> ten | C10: ten | D10: of:=[.A10] -> L | E10: 4*L=28 | F10: of:=[.E10] -> 4*L=28 | G10: of:=[.H10] -> phor tenza tuti et | H10: phor tenza tuti et
A11: J | B11: of:=[.C11] -> zileven | C11: zileven | D11: of:=[.A11] -> J | E11: 4*J=2Q | F11: of:=[.E11] -> 4*J=2Q | G11: of:=[.H11] -> phor zilevenza tuti kvelv | H11: phor zilevenza tuti kvelv
A12: Q | B12: of:=[.C12] -> kvelv | C12: kvelv | D12: of:=[.A12] -> Q | E12: 4*Q=30 | F12: of:=[.E12] -> 4*Q=30 | G12: of:=[.H12] -> phor kvelvza Thriti | H12: phor kvelvza Thriti
A13: W | B13: of:=[.C13] -> dblun | C13: dblun | D13: of:=[.A13] -> W | E13: 4*W=34 | F13: of:=[.E13] -> 4*W=34 | G13: of:=[.H13] -> phor dblunza Thriti phor | H13: phor dblunza Thriti phor
A14: X | B14: of:=[.C14] -> Aksen | C14: Aksen | D14: of:=[.A14] -> X | E14: 4*X=38 | F14: of:=[.E14] -> 4*X=38 | G14: of:=[.H14] -> phor Aksenza Thriti et | H14: phor Aksenza Thriti et
A15: F | B15: of:=[.C15] -> phen | C15: phen | D15: of:=[.A15] -> F | E15: 4*F=3Q | F15: of:=[.E15] -> 4*F=3Q | G15: of:=[.H15] -> phor phenza Thriti kvelv | H15: phor phenza Thriti kvelv
A16: 10 | B16: of:=[.C16] -> vnti | C16: vnti | D16: of:=[.A16] -> 10 | E16: 4*10=40 | F16: of:=[.E16] -> 4*10=40 | G16: of:=[.H16] -> phor vntiza phorti | H16: phor vntiza phorti

Sheet: 5tebl
A1: 1 | B1: of:=[.C1] -> vn | C1: vn | D1: of:=[.A1] -> 1 | E1: 5*1=5 | F1: of:=[.E1] -> 5*1=5 | G1: of:=[.H1] -> phaiv vnza phaiv | H1: phaiv vnza phaiv
A2: 2 | B2: of:=[.C2] -> tu | C2: tu | D2: of:=[.A2] -> 2 | E2: 5*2=L | F2: of:=[.E2] -> 5*2=L | G2: of:=[.H2] -> phaiv tuza ten | H2: phaiv tuza ten
A3: 3 | B3: of:=[.C3] -> Thri | C3: Thri | D3: of:=[.A3] -> 3 | E3: 5*3=F | F3: of:=[.E3] -> 5*3=F | G3: of:=[.H3] -> phaiv Thriza phen | H3: phaiv Thriza phen
A4: 4 | B4: of:=[.C4] -> phor | C4: phor | D4: of:=[.A4] -> 4 | E4: 5*4=14 | F4: of:=[.E4] -> 5*4=14 | G4: of:=[.H4] -> phaiv phorza vnti phor | H4: phaiv phorza vnti phor
A5: 5 | B5: of:=[.C5] -> phaiv | C5: phaiv | D5: of:=[.A5] -> 5 | E5: 5*5=19 | F5: of:=[.E5] -> 5*5=19 | G5: of:=[.H5] -> phaiv phaivza vnti nain | H5: phaiv phaivza vnti nain
A6: 6 | B6: of:=[.C6] -> siks | C6: siks | D6: of:=[.A6] -> 6 | E6: 5*6=1X | F6: of:=[.E6] -> 5*6=1X | G6: of:=[.H6] -> phaiv siksza vnti Aksen | H6: phaiv siksza vnti Aksen
A7: 7 | B7: of:=[.C7] -> seven | C7: seven | D7: of:=[.A7] -> 7 | E7: 5*7=23 | F7: of:=[.E7] -> 5*7=23 | G7: of:=[.H7] -> phaiv sevenza tuti Thri | H7: phaiv sevenza tuti Thri
A8: 8 | B8: of:=[.C8] -> et | C8: et | D8: of:=[.A8] -> 8 | E8: 5*8=28 | F8: of:=[.E8] -> 5*8=28 | G8: of:=[.H8] -> phaiv etza tuti et | H8: phaiv etza tuti et
A9: 9 | B9: of:=[.C9] -> nain | C9: nain | D9: of:=[.A9] -> 9 | E9: 5*9=2W | F9: of:=[.E9] -> 5*9=2W | G9: of:=[.H9] -> phaiv nainza tuti dblun | H9: phaiv nainza tuti dblun
A10: L | B10: of:=[.C10] -> ten | C10: ten | D10: of:=[.A10] -> L | E10: 5*L=32 | F10: of:=[.E10] -> 5*L=32 | G10: of:=[.H10] -> phaiv tenza Thriti tu | H10: phaiv tenza Thriti tu
A11: J | B11: of:=[.C11] -> zileven | C11: zileven | D11: of:=[.A11] -> J | E11: 5*J=37 | F11: of:=[.E11] -> 5*J=37 | G11: of:=[.H11] -> phaiv zilevenza Thriti seven | H11: phaiv zilevenza Thriti seven
A12: Q | B12: of:=[.C12] -> kvelv | C12: kvelv | D12: of:=[.A12] -> Q | E12: 5*Q=3Q | F12: of:=[.E12] -> 5*Q=3Q | G12: of:=[.H12] -> phaiv kvelvza Thriti kvelv | H12: phaiv kvelvza Thriti kvelv
A13: W | B13: of:=[.C13] -> dblun | C13: dblun | D13: of:=[.A13] -> W | E13: 5*W=41 | F13: of:=[.E13] -> 5*W=41 | G13: of:=[.H13] -> phaiv dblunza phorti vn | H13: phaiv dblunza phorti vn
A14: X | B14: of:=[.C14] -> Aksen | C14: Aksen | D14: of:=[.A14] -> X | E14: 5*X=46 | F14: of:=[.E14] -> 5*X=46 | G14: of:=[.H14] -> phaiv Aksenza phorti siks | H14: phaiv Aksenza phorti siks
A15: F | B15: of:=[.C15] -> phen | C15: phen | D15: of:=[.A15] -> F | E15: 5*F=4J | F15: of:=[.E15] -> 5*F=4J | G15: of:=[.H15] -> phaiv phenza phorti zileven | H15: phaiv phenza phorti zileven
A16: 10 | B16: of:=[.C16] -> vnti | C16: vnti | D16: of:=[.A16] -> 10 | E16: 5*10=50 | F16: of:=[.E16] -> 5*10=50 | G16: of:=[.H16] -> phaiv vntiza phaivti | H16: phaiv vntiza phaivti

Sheet: 6tebl
A1: 1 | B1: of:=[.C1] -> vn | C1: vn | D1: of:=[.A1] -> 1 | E1: 6*1=6 | F1: of:=[.E1] -> 6*1=6 | G1: of:=[.H1] -> siks vnza siks | H1: siks vnza siks
A2: 2 | B2: of:=[.C2] -> tu | C2: tu | D2: of:=[.A2] -> 2 | E2: 6*2=Q | F2: of:=[.E2] -> 6*2=Q | G2: of:=[.H2] -> siks tuza kvelv | H2: siks tuza kvelv
A3: 3 | B3: of:=[.C3] -> Thri | C3: Thri | D3: of:=[.A3] -> 3 | E3: 6*3=12 | F3: of:=[.E3] -> 6*3=12 | G3: of:=[.H3] -> siks Thriza vnti tu | H3: siks Thriza vnti tu
A4: 4 | B4: of:=[.C4] -> phor | C4: phor | D4: of:=[.A4] -> 4 | E4: 6*4=18 | F4: of:=[.E4] -> 6*4=18 | G4: of:=[.H4] -> siks phorza vnti et | H4: siks phorza vnti et
A5: 5 | B5: of:=[.C5] -> phaiv | C5: phaiv | D5: of:=[.A5] -> 5 | E5: 6*5=1X | F5: of:=[.E5] -> 6*5=1X | G5: of:=[.H5] -> siks phaivza vnti Aksen | H5: siks phaivza vnti Aksen
A6: 6 | B6: of:=[.C6] -> siks | C6: siks | D6: of:=[.A6] -> 6 | E6: 6*6=24 | F6: of:=[.E6] -> 6*6=24 | G6: of:=[.H6] -> siks siksza tuti phor | H6: siks siksza tuti phor
A7: 7 | B7: of:=[.C7] -> seven | C7: seven | D7: of:=[.A7] -> 7 | E7: 6*7=2L | F7: of:=[.E7] -> 6*7=2L | G7: of:=[.H7] -> siks sevenza tuti ten | H7: siks sevenza tuti ten
A8: 8 | B8: of:=[.C8] -> et | C8: et | D8: of:=[.A8] -> 8 | E8: 6*8=30 | F8: of:=[.E8] -> 6*8=30 | G8: of:=[.H8] -> siks etza Thriti | H8: siks etza Thriti
A9: 9 | B9: of:=[.C9] -> nain | C9: nain | D9: of:=[.A9] -> 9 | E9: 6*9=36 | F9: of:=[.E9] -> 6*9=36 | G9: of:=[.H9] -> siks nainza Thriti siks | H9: siks nainza Thriti siks
A10: L | B10: of:=[.C10] -> ten | C10: ten | D10: of:=[.A10] -> L | E10: 6*L=3Q | F10: of:=[.E10] -> 6*L=3Q | G10: of:=[.H10] -> siks tenza Thriti kvelv | H10: siks tenza Thriti kvelv
A11: J | B11: of:=[.C11] -> zileven | C11: zileven | D11: of:=[.A11] -> J | E11: 6*J=42 | F11: of:=[.E11] -> 6*J=42 | G11: of:=[.H11] -> siks zilevenza phorti tu | H11: siks zilevenza phorti tu
A12: Q | B12: of:=[.C12] -> kvelv | C12: kvelv | D12: of:=[.A12] -> Q | E12: 6*Q=48 | F12: of:=[.E12] -> 6*Q=48 | G12: of:=[.H12] -> siks kvelvza phorti et | H12: siks kvelvza phorti et
A13: W | B13: of:=[.C13] -> dblun | C13: dblun | D13: of:=[.A13] -> W | E13: 6*W=4X | F13: of:=[.E13] -> 6*W=4X | G13: of:=[.H13] -> siks dblunza phorti Aksen | H13: siks dblunza phorti Aksen
A14: X | B14: of:=[.C14] -> Aksen | C14: Aksen | D14: of:=[.A14] -> X | E14: 6*X=54 | F14: of:=[.E14] -> 6*X=54 | G14: of:=[.H14] -> siks Aksenza phaivti phor | H14: siks Aksenza phaivti phor
A15: F | B15: of:=[.C15] -> phen | C15: phen | D15: of:=[.A15] -> F | E15: 6*F=5L | F15: of:=[.E15] -> 6*F=5L | G15: of:=[.H15] -> siks phenza phaivti ten | H15: siks phenza phaivti ten
A16: 10 | B16: of:=[.C16] -> vnti | C16: vnti | D16: of:=[.A16] -> 10 | E16: 6*10=60 | F16: of:=[.E16] -> 6*10=60 | G16: of:=[.H16] -> siks vntiza siksti | H16: siks vntiza siksti

Sheet: 7tebl
A1: 1 | B1: of:=[.C1] -> vn | C1: vn | D1: of:=[.A1] -> 1 | E1: 7*1=7 | F1: of:=[.E1] -> 7*1=7 | G1: of:=[.H1] -> seven vnza seven | H1: seven vnza seven
A2: 2 | B2: of:=[.C2] -> tu | C2: tu | D2: of:=[.A2] -> 2 | E2: 7*2=X | F2: of:=[.E2] -> 7*2=X | G2: of:=[.H2] -> seven tuza Aksen | H2: seven tuza Aksen
A3: 3 | B3: of:=[.C3] -> Thri | C3: Thri | D3: of:=[.A3] -> 3 | E3: 7*3=15 | F3: of:=[.E3] -> 7*3=15 | G3: of:=[.H3] -> seven Thriza vnti phaiv | H3: seven Thriza vnti phaiv
A4: 4 | B4: of:=[.C4] -> phor | C4: phor | D4: of:=[.A4] -> 4 | E4: 7*4=1Q | F4: of:=[.E4] -> 7*4=1Q | G4: of:=[.H4] -> seven phorza vnti kvelv | H4: seven phorza vnti kvelv
A5: 5 | B5: of:=[.C5] -> phaiv | C5: phaiv | D5: of:=[.A5] -> 5 | E5: 7*5=23 | F5: of:=[.E5] -> 7*5=23 | G5: of:=[.H5] -> seven phaivza tuti Thri | H5: seven phaivza tuti Thri
A6: 6 | B6: of:=[.C6] -> siks | C6: siks | D6: of:=[.A6] -> 6 | E6: 7*6=2L | F6: of:=[.E6] -> 7*6=2L | G6: of:=[.H6] -> seven siksza tuti ten | H6: seven siksza tuti ten
A7: 7 | B7: of:=[.C7] -> seven | C7: seven | D7: of:=[.A7] -> 7 | E7: 7*7=31 | F7: of:=[.E7] -> 7*7=31 | G7: of:=[.H7] -> seven sevenza Thriti vn | H7: seven sevenza Thriti vn
A8: 8 | B8: of:=[.C8] -> et | C8: et | D8: of:=[.A8] -> 8 | E8: 7*8=38 | F8: of:=[.E8] -> 7*8=38 | G8: of:=[.H8] -> seven etza Thriti et | H8: seven etza Thriti et
A9: 9 | B9: of:=[.C9] -> nain | C9: nain | D9: of:=[.A9] -> 9 | E9: 7*9=3F | F9: of:=[.E9] -> 7*9=3F | G9: of:=[.H9] -> seven nainza Thriti phen | H9: seven nainza Thriti phen
A10: L | B10: of:=[.C10] -> ten | C10: ten | D10: of:=[.A10] -> L | E10: 7*L=46 | F10: of:=[.E10] -> 7*L=46 | G10: of:=[.H10] -> seven tenza phorti siks | H10: seven tenza phorti siks
A11: J | B11: of:=[.C11] -> zileven | C11: zileven | D11: of:=[.A11] -> J | E11: 7*J=4W | F11: of:=[.E11] -> 7*J=4W | G11: of:=[.H11] -> seven zilevenza phorti dblun | H11: seven zilevenza phorti dblun
A12: Q | B12: of:=[.C12] -> kvelv | C12: kvelv | D12: of:=[.A12] -> Q | E12: 7*Q=54 | F12: of:=[.E12] -> 7*Q=54 | G12: of:=[.H12] -> seven kvelvza phaivti phor | H12: seven kvelvza phaivti phor
A13: W | B13: of:=[.C13] -> dblun | C13: dblun | D13: of:=[.A13] -> W | E13: 7*W=5J | F13: of:=[.E13] -> 7*W=5J | G13: of:=[.H13] -> seven dblunza phaivti zileven | H13: seven dblunza phaivti zileven
A14: X | B14: of:=[.C14] -> Aksen | C14: Aksen | D14: of:=[.A14] -> X | E14: 7*X=62 | F14: of:=[.E14] -> 7*X=62 | G14: of:=[.H14] -> seven Aksenza siksti tu | H14: seven Aksenza siksti tu
A15: F | B15: of:=[.C15] -> phen | C15: phen | D15: of:=[.A15] -> F | E15: 7*F=69 | F15: of:=[.E15] -> 7*F=69 | G15: of:=[.H15] -> seven phenza siksti nain | H15: seven phenza siksti nain
A16: 10 | B16: of:=[.C16] -> vnti | C16: vnti | D16: of:=[.A16] -> 10 | E16: 7*10=70 | F16: of:=[.E16] -> 7*10=70 | G16: of:=[.H16] -> seven vntiza seventi | H16: seven vntiza seventi

Sheet: 8tebl
A1: 1 | B1: of:=[.C1] -> vn | C1: vn | D1: of:=[.A1] -> 1 | E1: 8*1=8 | F1: of:=[.E1] -> 8*1=8 | G1: of:=[.H1] -> et vnza et | H1: et vnza et
A2: 2 | B2: of:=[.C2] -> tu | C2: tu | D2: of:=[.A2] -> 2 | E2: 8*2=10 | F2: of:=[.E2] -> 8*2=10 | G2: of:=[.H2] -> et tuza vnti | H2: et tuza vnti
A3: 3 | B3: of:=[.C3] -> Thri | C3: Thri | D3: of:=[.A3] -> 3 | E3: 8*3=18 | F3: of:=[.E3] -> 8*3=18 | G3: of:=[.H3] -> et Thriza vnti et | H3: et Thriza vnti et
A4: 4 | B4: of:=[.C4] -> phor | C4: phor | D4: of:=[.A4] -> 4 | E4: 8*4=20 | F4: of:=[.E4] -> 8*4=20 | G4: of:=[.H4] -> et phorza tuti | H4: et phorza tuti
A5: 5 | B5: of:=[.C5] -> phaiv | C5: phaiv | D5: of:=[.A5] -> 5 | E5: 8*5=28 | F5: of:=[.E5] -> 8*5=28 | G5: of:=[.H5] -> et phaivza tuti et | H5: et phaivza tuti et
A6: 6 | B6: of:=[.C6] -> siks | C6: siks | D6: of:=[.A6] -> 6 | E6: 8*6=30 | F6: of:=[.E6] -> 8*6=30 | G6: of:=[.H6] -> et siksza Thriti | H6: et siksza Thriti
A7: 7 | B7: of:=[.C7] -> seven | C7: seven | D7: of:=[.A7] -> 7 | E7: 8*7=38 | F7: of:=[.E7] -> 8*7=38 | G7: of:=[.H7] -> et sevenza Thriti et | H7: et sevenza Thriti et
A8: 8 | B8: of:=[.C8] -> et | C8: et | D8: of:=[.A8] -> 8 | E8: 8*8=40 | F8: of:=[.E8] -> 8*8=40 | G8: of:=[.H8] -> et etza phorti | H8: et etza phorti
A9: 9 | B9: of:=[.C9] -> nain | C9: nain | D9: of:=[.A9] -> 9 | E9: 8*9=48 | F9: of:=[.E9] -> 8*9=48 | G9: of:=[.H9] -> et nainza phorti et | H9: et nainza phorti et
A10: L | B10: of:=[.C10] -> ten | C10: ten | D10: of:=[.A10] -> L | E10: 8*L=50 | F10: of:=[.E10] -> 8*L=50 | G10: of:=[.H10] -> et tenza phaivti | H10: et tenza phaivti
A11: J | B11: of:=[.C11] -> zileven | C11: zileven | D11: of:=[.A11] -> J | E11: 8*J=58 | F11: of:=[.E11] -> 8*J=58 | G11: of:=[.H11] -> et zilevenza phaivti et | H11: et zilevenza phaivti et
A12: Q | B12: of:=[.C12] -> kvelv | C12: kvelv | D12: of:=[.A12] -> Q | E12: 8*Q=60 | F12: of:=[.E12] -> 8*Q=60 | G12: of:=[.H12] -> et kvelvza siksti | H12: et kvelvza siksti
A13: W | B13: of:=[.C13] -> dblun | C13: dblun | D13: of:=[.A13] -> W | E13: 8*W=68 | F13: of:=[.E13] -> 8*W=68 | G13: of:=[.H13] -> et dblunza siksti et | H13: et dblunza siksti et
A14: X | B14: of:=[.C14] -> Aksen | C14: Aksen | D14: of:=[.A14] -> X | E14: 8*X=70 | F14: of:=[.E14] -> 8*X=70 | G14: of:=[.H14] -> et Aksenza seventi | H14: et Aksenza seventi
A15: F | B15: of:=[.C15] -> phen | C15: phen | D15: of:=[.A15] -> F | E15: 8*F=78 | F15: of:=[.E15] -> 8*F=78 | G15: of:=[.H15] -> et phenza seventi et | H15: et phenza seventi et
A16: 10 | B16: of:=[.C16] -> vnti | C16: vnti | D16: of:=[.A16] -> 10 | E16: 8*10=80 | F16: of:=[.E16] -> 8*10=80 | G16: of:=[.H16] -> et vntiza etti | H16: et vntiza etti

Sheet: 9tebl
A1: 1 | B1: of:=[.C1] -> vn | C1: vn | D1: of:=[.A1] -> 1 | E1: 9*1=9 | F1: of:=[.E1] -> 9*1=9 | G1: of:=[.H1] -> nain vnza nain | H1: nain vnza nain
A2: 2 | B2: of:=[.C2] -> tu | C2: tu | D2: of:=[.A2] -> 2 | E2: 9*2=12 | F2: of:=[.E2] -> 9*2=12 | G2: of:=[.H2] -> nain tuza vnti tu | H2: nain tuza vnti tu
A3: 3 | B3: of:=[.C3] -> Thri | C3: Thri | D3: of:=[.A3] -> 3 | E3: 9*3=1J | F3: of:=[.E3] -> 9*3=1J | G3: of:=[.H3] -> nain Thriza vnti zileven | H3: nain Thriza vnti zileven
A4: 4 | B4: of:=[.C4] -> phor | C4: phor | D4: of:=[.A4] -> 4 | E4: 9*4=24 | F4: of:=[.E4] -> 9*4=24 | G4: of:=[.H4] -> nain phorza tuti phor | H4: nain phorza tuti phor
A5: 5 | B5: of:=[.C5] -> phaiv | C5: phaiv | D5: of:=[.A5] -> 5 | E5: 9*5=2W | F5: of:=[.E5] -> 9*5=2W | G5: of:=[.H5] -> nain phaivza tuti dblun | H5: nain phaivza tuti dblun
A6: 6 | B6: of:=[.C6] -> siks | C6: siks | D6: of:=[.A6] -> 6 | E6: 9*6=36 | F6: of:=[.E6] -> 9*6=36 | G6: of:=[.H6] -> nain siksza Thriti siks | H6: nain siksza Thriti siks
A7: 7 | B7: of:=[.C7] -> seven | C7: seven | D7: of:=[.A7] -> 7 | E7: 9*7=3F | F7: of:=[.E7] -> 9*7=3F | G7: of:=[.H7] -> nain sevenza Thriti phen | H7: nain sevenza Thriti phen
A8: 8 | B8: of:=[.C8] -> et | C8: et | D8: of:=[.A8] -> 8 | E8: 9*8=48 | F8: of:=[.E8] -> 9*8=48 | G8: of:=[.H8] -> nain etza phorti et | H8: nain etza phorti et
A9: 9 | B9: of:=[.C9] -> nain | C9: nain | D9: of:=[.A9] -> 9 | E9: 9*9=51 | F9: of:=[.E9] -> 9*9=51 | G9: of:=[.H9] -> nain nainza phaivti vn | H9: nain nainza phaivti vn
A10: L | B10: of:=[.C10] -> ten | C10: ten | D10: of:=[.A10] -> L | E10: 9*L=5L | F10: of:=[.E10] -> 9*L=5L | G10: of:=[.H10] -> nain tenza phaivti ten | H10: nain tenza phaivti ten
A11: J | B11: of:=[.C11] -> zileven | C11: zileven | D11: of:=[.A11] -> J | E11: 9*J=63 | F11: of:=[.E11] -> 9*J=63 | G11: of:=[.H11] -> nain zilevenza siksti Thri | H11: nain zilevenza siksti Thri
A12: Q | B12: of:=[.C12] -> kvelv | C12: kvelv | D12: of:=[.A12] -> Q | E12: 9*Q=6Q | F12: of:=[.E12] -> 9*Q=6Q | G12: of:=[.H12] -> nain kvelvza siksti kvelv | H12: nain kvelvza siksti kvelv
A13: W | B13: of:=[.C13] -> dblun | C13: dblun | D13: of:=[.A13] -> W | E13: 9*W=75 | F13: of:=[.E13] -> 9*W=75 | G13: of:=[.H13] -> nain dblunza seventi phaiv | H13: nain dblunza seventi phaiv
A14: X | B14: of:=[.C14] -> Aksen | C14: Aksen | D14: of:=[.A14] -> X | E14: 9*X=7X | F14: of:=[.E14] -> 9*X=7X | G14: of:=[.H14] -> nain Aksenza seventi Aksen | H14: nain Aksenza seventi Aksen
A15: F | B15: of:=[.C15] -> phen | C15: phen | D15: of:=[.A15] -> F | E15: 9*F=87 | F15: of:=[.E15] -> 9*F=87 | G15: of:=[.H15] -> nain phenza etti seven | H15: nain phenza etti seven
A16: 10 | B16: of:=[.C16] -> vnti | C16: vnti | D16: of:=[.A16] -> 10 | E16: 9*10=90 | F16: of:=[.E16] -> 9*10=90 | G16: of:=[.H16] -> nain vntiza nainti | H16: nain vntiza nainti

Sheet: Ltebl
A1: 1 | B1: of:=[.C1] -> vn | C1: vn | D1: of:=[.A1] -> 1 | E1: L*1=L | F1: of:=[.E1] -> L*1=L | G1: of:=[.H1] -> ten vnza ten | H1: ten vnza ten
A2: 2 | B2: of:=[.C2] -> tu | C2: tu | D2: of:=[.A2] -> 2 | E2: L*2=14 | F2: of:=[.E2] -> L*2=14 | G2: of:=[.H2] -> ten tuza vnti phor | H2: ten tuza vnti phor
A3: 3 | B3: of:=[.C3] -> Thri | C3: Thri | D3: of:=[.A3] -> 3 | E3: L*3=1X | F3: of:=[.E3] -> L*3=1X | G3: of:=[.H3] -> ten Thriza vnti Aksen | H3: ten Thriza vnti Aksen
A4: 4 | B4: of:=[.C4] -> phor | C4: phor | D4: of:=[.A4] -> 4 | E4: L*4=28 | F4: of:=[.E4] -> L*4=28 | G4: of:=[.H4] -> ten phorza tuti et | H4: ten phorza tuti et
A5: 5 | B5: of:=[.C5] -> phaiv | C5: phaiv | D5: of:=[.A5] -> 5 | E5: L*5=32 | F5: of:=[.E5] -> L*5=32 | G5: of:=[.H5] -> ten phaivza Thriti tu | H5: ten phaivza Thriti tu
A6: 6 | B6: of:=[.C6] -> siks | C6: siks | D6: of:=[.A6] -> 6 | E6: L*6=3Q | F6: of:=[.E6] -> L*6=3Q | G6: of:=[.H6] -> ten siksza Thriti kvelv | H6: ten siksza Thriti kvelv
A7: 7 | B7: of:=[.C7] -> seven | C7: seven | D7: of:=[.A7] -> 7 | E7: L*7=46 | F7: of:=[.E7] -> L*7=46 | G7: of:=[.H7] -> ten sevenza phorti siks | H7: ten sevenza phorti siks
A8: 8 | B8: of:=[.C8] -> et | C8: et | D8: of:=[.A8] -> 8 | E8: L*8=50 | F8: of:=[.E8] -> L*8=50 | G8: of:=[.H8] -> ten etza phaivti | H8: ten etza phaivti
A9: 9 | B9: of:=[.C9] -> nain | C9: nain | D9: of:=[.A9] -> 9 | E9: L*9=5L | F9: of:=[.E9] -> L*9=5L | G9: of:=[.H9] -> ten nainza phaivti ten | H9: ten nainza phaivti ten
A10: L | B10: of:=[.C10] -> ten | C10: ten | D10: of:=[.A10] -> L | E10: L*L=64 | F10: of:=[.E10] -> L*L=64 | G10: of:=[.H10] -> ten tenza siksti phor | H10: ten tenza siksti phor
A11: J | B11: of:=[.C11] -> zileven | C11: zileven | D11: of:=[.A11] -> J | E11: L*J=6X | F11: of:=[.E11] -> L*J=6X | G11: of:=[.H11] -> ten zilevenza siksti Aksen | H11: ten zilevenza siksti Aksen
A12: Q | B12: of:=[.C12] -> kvelv | C12: kvelv | D12: of:=[.A12] -> Q | E12: L*Q=78 | F12: of:=[.E12] -> L*Q=78 | G12: of:=[.H12] -> ten kvelvza seventi et | H12: ten kvelvza seventi et
A13: W | B13: of:=[.C13] -> dblun | C13: dblun | D13: of:=[.A13] -> W | E13: L*W=82 | F13: of:=[.E13] -> L*W=82 | G13: of:=[.H13] -> ten dblunza etti tu | H13: ten dblunza etti tu
A14: X | B14: of:=[.C14] -> Aksen | C14: Aksen | D14: of:=[.A14] -> X | E14: L*X=8Q | F14: of:=[.E14] -> L*X=8Q | G14: of:=[.H14] -> ten Aksenza etti kvelv | H14: ten Aksenza etti kvelv
A15: F | B15: of:=[.C15] -> phen | C15: phen | D15: of:=[.A15] -> F | E15: L*F=96 | F15: of:=[.E15] -> L*F=96 | G15: of:=[.H15] -> ten phenza nainti siks | H15: ten phenza nainti siks
A16: 10 | B16: of:=[.C16] -> vnti | C16: vnti | D16: of:=[.A16] -> 10 | E16: L*10=L0 | F16: of:=[.E16] -> L*10=L0 | G16: of:=[.H16] -> ten vntiza tenti | H16: ten vntiza tenti

Sheet: Jtebl
A1: 1 | B1: of:=[.C1] -> vn | C1: vn | D1: of:=[.A1] -> 1 | E1: J*1=J | F1: of:=[.E1] -> J*1=J | G1: of:=[.H1] -> zileven vnza zileven | H1: zileven vnza zileven
A2: 2 | B2: of:=[.C2] -> tu | C2: tu | D2: of:=[.A2] -> 2 | E2: J*2=16 | F2: of:=[.E2] -> J*2=16 | G2: of:=[.H2] -> zileven tuza vnti siks | H2: zileven tuza vnti siks
A3: 3 | B3: of:=[.C3] -> Thri | C3: Thri | D3: of:=[.A3] -> 3 | E3: J*3=21 | F3: of:=[.E3] -> J*3=21 | G3: of:=[.H3] -> zileven Thriza tuti vn | H3: zileven Thriza tuti vn
A4: 4 | B4: of:=[.C4] -> phor | C4: phor | D4: of:=[.A4] -> 4 | E4: J*4=2Q | F4: of:=[.E4] -> J*4=2Q | G4: of:=[.H4] -> zileven phorza tuti kvelv | H4: zileven phorza tuti kvelv
A5: 5 | B5: of:=[.C5] -> phaiv | C5: phaiv | D5: of:=[.A5] -> 5 | E5: J*5=37 | F5: of:=[.E5] -> J*5=37 | G5: of:=[.H5] -> zileven phaivza Thriti seven | H5: zileven phaivza Thriti seven
A6: 6 | B6: of:=[.C6] -> siks | C6: siks | D6: of:=[.A6] -> 6 | E6: J*6=42 | F6: of:=[.E6] -> J*6=42 | G6: of:=[.H6] -> zileven siksza phorti tu | H6: zileven siksza phorti tu
A7: 7 | B7: of:=[.C7] -> seven | C7: seven | D7: of:=[.A7] -> 7 | E7: J*7=4W | F7: of:=[.E7] -> J*7=4W | G7: of:=[.H7] -> zileven sevenza phorti dblun | H7: zileven sevenza phorti dblun
A8: 8 | B8: of:=[.C8] -> et | C8: et | D8: of:=[.A8] -> 8 | E8: J*8=58 | F8: of:=[.E8] -> J*8=58 | G8: of:=[.H8] -> zileven etza phaivti et | H8: zileven etza phaivti et
A9: 9 | B9: of:=[.C9] -> nain | C9: nain | D9: of:=[.A9] -> 9 | E9: J*9=63 | F9: of:=[.E9] -> J*9=63 | G9: of:=[.H9] -> zileven nainza siksti Thri | H9: zileven nainza siksti Thri
A10: L | B10: of:=[.C10] -> ten | C10: ten | D10: of:=[.A10] -> L | E10: J*L=6X | F10: of:=[.E10] -> J*L=6X | G10: of:=[.H10] -> zileven tenza siksti Aksen | H10: zileven tenza siksti Aksen
A11: J | B11: of:=[.C11] -> zileven | C11: zileven | D11: of:=[.A11] -> J | E11: J*J=79 | F11: of:=[.E11] -> J*J=79 | G11: of:=[.H11] -> zileven zilevenza seventi nain | H11: zileven zilevenza seventi nain
A12: Q | B12: of:=[.C12] -> kvelv | C12: kvelv | D12: of:=[.A12] -> Q | E12: J*Q=84 | F12: of:=[.E12] -> J*Q=84 | G12: of:=[.H12] -> zileven kvelvza etti phor | H12: zileven kvelvza etti phor
A13: W | B13: of:=[.C13] -> dblun | C13: dblun | D13: of:=[.A13] -> W | E13: J*W=8F | F13: of:=[.E13] -> J*W=8F | G13: of:=[.H13] -> zileven dblunza etti phen | H13: zileven dblunza etti phen
A14: X | B14: of:=[.C14] -> Aksen | C14: Aksen | D14: of:=[.A14] -> X | E14: J*X=9L | F14: of:=[.E14] -> J*X=9L | G14: of:=[.H14] -> zileven Aksenza nainti ten | H14: zileven Aksenza nainti ten
A15: F | B15: of:=[.C15] -> phen | C15: phen | D15: of:=[.A15] -> F | E15: J*F=L5 | F15: of:=[.E15] -> J*F=L5 | G15: of:=[.H15] -> zileven phenza tenti phaiv | H15: zileven phenza tenti phaiv
A16: 10 | B16: of:=[.C16] -> vnti | C16: vnti | D16: of:=[.A16] -> 10 | E16: J*10=J0 | F16: of:=[.E16] -> J*10=J0 | G16: of:=[.H16] -> zileven vntiza zileventi | H16: zileven vntiza zileventi

Sheet: Qtebl
A1: 1 | B1: of:=[.C1] -> vn | C1: vn | D1: of:=[.A1] -> 1 | E1: Q*1=Q | F1: of:=[.E1] -> Q*1=Q | G1: of:=[.H1] -> kvelv vnza kvelv | H1: kvelv vnza kvelv
A2: 2 | B2: of:=[.C2] -> tu | C2: tu | D2: of:=[.A2] -> 2 | E2: Q*2=18 | F2: of:=[.E2] -> Q*2=18 | G2: of:=[.H2] -> kvelv tuza vnti et | H2: kvelv tuza vnti et
A3: 3 | B3: of:=[.C3] -> Thri | C3: Thri | D3: of:=[.A3] -> 3 | E3: Q*3=24 | F3: of:=[.E3] -> Q*3=24 | G3: of:=[.H3] -> kvelv Thriza tuti phor | H3: kvelv Thriza tuti phor
A4: 4 | B4: of:=[.C4] -> phor | C4: phor | D4: of:=[.A4] -> 4 | E4: Q*4=30 | F4: of:=[.E4] -> Q*4=30 | G4: of:=[.H4] -> kvelv phorza Thriti | H4: kvelv phorza Thriti
A5: 5 | B5: of:=[.C5] -> phaiv | C5: phaiv | D5: of:=[.A5] -> 5 | E5: Q*5=3Q | F5: of:=[.E5] -> Q*5=3Q | G5: of:=[.H5] -> kvelv phaivza Thriti kvelv | H5: kvelv phaivza Thriti kvelv
A6: 6 | B6: of:=[.C6] -> siks | C6: siks | D6: of:=[.A6] -> 6 | E6: Q*6=48 | F6: of:=[.E6] -> Q*6=48 | G6: of:=[.H6] -> kvelv siksza phorti et | H6: kvelv siksza phorti et
A7: 7 | B7: of:=[.C7] -> seven | C7: seven | D7: of:=[.A7] -> 7 | E7: Q*7=54 | F7: of:=[.E7] -> Q*7=54 | G7: of:=[.H7] -> kvelv sevenza phaivti phor | H7: kvelv sevenza phaivti phor
A8: 8 | B8: of:=[.C8] -> et | C8: et | D8: of:=[.A8] -> 8 | E8: Q*8=60 | F8: of:=[.E8] -> Q*8=60 | G8: of:=[.H8] -> kvelv etza siksti | H8: kvelv etza siksti
A9: 9 | B9: of:=[.C9] -> nain | C9: nain | D9: of:=[.A9] -> 9 | E9: Q*9=6Q | F9: of:=[.E9] -> Q*9=6Q | G9: of:=[.H9] -> kvelv nainza siksti kvelv | H9: kvelv nainza siksti kvelv
A10: L | B10: of:=[.C10] -> ten | C10: ten | D10: of:=[.A10] -> L | E10: Q*L=78 | F10: of:=[.E10] -> Q*L=78 | G10: of:=[.H10] -> kvelv tenza seventi et | H10: kvelv tenza seventi et
A11: J | B11: of:=[.C11] -> zileven | C11: zileven | D11: of:=[.A11] -> J | E11: Q*J=84 | F11: of:=[.E11] -> Q*J=84 | G11: of:=[.H11] -> kvelv zilevenza etti phor | H11: kvelv zilevenza etti phor
A12: Q | B12: of:=[.C12] -> kvelv | C12: kvelv | D12: of:=[.A12] -> Q | E12: Q*Q=90 | F12: of:=[.E12] -> Q*Q=90 | G12: of:=[.H12] -> kvelv kvelvza nainti | H12: kvelv kvelvza nainti
A13: W | B13: of:=[.C13] -> dblun | C13: dblun | D13: of:=[.A13] -> W | E13: Q*W=9Q | F13: of:=[.E13] -> Q*W=9Q | G13: of:=[.H13] -> kvelv dblunza nainti kvelv | H13: kvelv dblunza nainti kvelv
A14: X | B14: of:=[.C14] -> Aksen | C14: Aksen | D14: of:=[.A14] -> X | E14: Q*X=L8 | F14: of:=[.E14] -> Q*X=L8 | G14: of:=[.H14] -> kvelv Aksenza tenti et | H14: kvelv Aksenza tenti et
A15: F | B15: of:=[.C15] -> phen | C15: phen | D15: of:=[.A15] -> F | E15: Q*F=J4 | F15: of:=[.E15] -> Q*F=J4 | G15: of:=[.H15] -> kvelv phenza zileventi phor | H15: kvelv phenza zileventi phor
A16: 10 | B16: of:=[.C16] -> vnti | C16: vnti | D16: of:=[.A16] -> 10 | E16: Q*10=Q0 | F16: of:=[.E16] -> Q*10=Q0 | G16: of:=[.H16] -> kvelv vntiza kvelvti | H16: kvelv vntiza kvelvti

Sheet: Wtebl
A1: 1 | B1: of:=[.C1] -> vn | C1: vn | D1: of:=[.A1] -> 1 | E1: W*1=W | F1: of:=[.E1] -> W*1=W | G1: of:=[.H1] -> dblun vnza dblun | H1: dblun vnza dblun
A2: 2 | B2: of:=[.C2] -> tu | C2: tu | D2: of:=[.A2] -> 2 | E2: W*2=1L | F2: of:=[.E2] -> W*2=1L | G2: of:=[.H2] -> dblun tuza vnti ten | H2: dblun tuza vnti ten
A3: 3 | B3: of:=[.C3] -> Thri | C3: Thri | D3: of:=[.A3] -> 3 | E3: W*3=27 | F3: of:=[.E3] -> W*3=27 | G3: of:=[.H3] -> dblun Thriza tuti seven | H3: dblun Thriza tuti seven
A4: 4 | B4: of:=[.C4] -> phor | C4: phor | D4: of:=[.A4] -> 4 | E4: W*4=34 | F4: of:=[.E4] -> W*4=34 | G4: of:=[.H4] -> dblun phorza Thriti phor | H4: dblun phorza Thriti phor
A5: 5 | B5: of:=[.C5] -> phaiv | C5: phaiv | D5: of:=[.A5] -> 5 | E5: W*5=41 | F5: of:=[.E5] -> W*5=41 | G5: of:=[.H5] -> dblun phaivza phorti vn | H5: dblun phaivza phorti vn
A6: 6 | B6: of:=[.C6] -> siks | C6: siks | D6: of:=[.A6] -> 6 | E6: W*6=4X | F6: of:=[.E6] -> W*6=4X | G6: of:=[.H6] -> dblun siksza phorti Aksen | H6: dblun siksza phorti Aksen
A7: 7 | B7: of:=[.C7] -> seven | C7: seven | D7: of:=[.A7] -> 7 | E7: W*7=5J | F7: of:=[.E7] -> W*7=5J | G7: of:=[.H7] -> dblun sevenza phaivti zileven | H7: dblun sevenza phaivti zileven
A8: 8 | B8: of:=[.C8] -> et | C8: et | D8: of:=[.A8] -> 8 | E8: W*8=68 | F8: of:=[.E8] -> W*8=68 | G8: of:=[.H8] -> dblun etza siksti et | H8: dblun etza siksti et
A9: 9 | B9: of:=[.C9] -> nain | C9: nain | D9: of:=[.A9] -> 9 | E9: W*9=75 | F9: of:=[.E9] -> W*9=75 | G9: of:=[.H9] -> dblun nainza seventi phaiv | H9: dblun nainza seventi phaiv
A10: L | B10: of:=[.C10] -> ten | C10: ten | D10: of:=[.A10] -> L | E10: W*L=82 | F10: of:=[.E10] -> W*L=82 | G10: of:=[.H10] -> dblun tenza etti tu | H10: dblun tenza etti tu
A11: J | B11: of:=[.C11] -> zileven | C11: zileven | D11: of:=[.A11] -> J | E11: W*J=8F | F11: of:=[.E11] -> W*J=8F | G11: of:=[.H11] -> dblun zilevenza etti phen | H11: dblun zilevenza etti phen
A12: Q | B12: of:=[.C12] -> kvelv | C12: kvelv | D12: of:=[.A12] -> Q | E12: W*Q=9Q | F12: of:=[.E12] -> W*Q=9Q | G12: of:=[.H12] -> dblun kvelvza nainti kvelv | H12: dblun kvelvza nainti kvelv
A13: W | B13: of:=[.C13] -> dblun | C13: dblun | D13: of:=[.A13] -> W | E13: W*W=L9 | F13: of:=[.E13] -> W*W=L9 | G13: of:=[.H13] -> dblun dblunza tenti nain | H13: dblun dblunza tenti nain
A14: X | B14: of:=[.C14] -> Aksen | C14: Aksen | D14: of:=[.A14] -> X | E14: W*X=J6 | F14: of:=[.E14] -> W*X=J6 | G14: of:=[.H14] -> dblun Aksenza zileventi siks | H14: dblun Aksenza zileventi siks
A15: F | B15: of:=[.C15] -> phen | C15: phen | D15: of:=[.A15] -> F | E15: W*F=Q3 | F15: of:=[.E15] -> W*F=Q3 | G15: of:=[.H15] -> dblun phenza kvelvti Thri | H15: dblun phenza kvelvti Thri
A16: 10 | B16: of:=[.C16] -> vnti | C16: vnti | D16: of:=[.A16] -> 10 | E16: W*10=W0 | F16: of:=[.E16] -> W*10=W0 | G16: of:=[.H16] -> dblun vntiza dblunti | H16: dblun vntiza dblunti

Sheet: Xtebl
A1: 1 | B1: of:=[.C1] -> vn | C1: vn | D1: of:=[.A1] -> 1 | E1: X*1=X | F1: of:=[.E1] -> X*1=X | G1: of:=[.H1] -> Aksen vnza Aksen | H1: Aksen vnza Aksen
A2: 2 | B2: of:=[.C2] -> tu | C2: tu | D2: of:=[.A2] -> 2 | E2: X*2=1Q | F2: of:=[.E2] -> X*2=1Q | G2: of:=[.H2] -> Aksen tuza vnti kvelv | H2: Aksen tuza vnti kvelv
A3: 3 | B3: of:=[.C3] -> Thri | C3: Thri | D3: of:=[.A3] -> 3 | E3: X*3=2L | F3: of:=[.E3] -> X*3=2L | G3: of:=[.H3] -> Aksen Thriza tuti ten | H3: Aksen Thriza tuti ten
A4: 4 | B4: of:=[.C4] -> phor | C4: phor | D4: of:=[.A4] -> 4 | E4: X*4=38 | F4: of:=[.E4] -> X*4=38 | G4: of:=[.H4] -> Aksen phorza Thriti et | H4: Aksen phorza Thriti et
A5: 5 | B5: of:=[.C5] -> phaiv | C5: phaiv | D5: of:=[.A5] -> 5 | E5: X*5=46 | F5: of:=[.E5] -> X*5=46 | G5: of:=[.H5] -> Aksen phaivza phorti siks | H5: Aksen phaivza phorti siks
A6: 6 | B6: of:=[.C6] -> siks | C6: siks | D6: of:=[.A6] -> 6 | E6: X*6=54 | F6: of:=[.E6] -> X*6=54 | G6: of:=[.H6] -> Aksen siksza phaivti phor | H6: Aksen siksza phaivti phor
A7: 7 | B7: of:=[.C7] -> seven | C7: seven | D7: of:=[.A7] -> 7 | E7: X*7=62 | F7: of:=[.E7] -> X*7=62 | G7: of:=[.H7] -> Aksen sevenza siksti tu | H7: Aksen sevenza siksti tu
A8: 8 | B8: of:=[.C8] -> et | C8: et | D8: of:=[.A8] -> 8 | E8: X*8=70 | F8: of:=[.E8] -> X*8=70 | G8: of:=[.H8] -> Aksen etza seventi | H8: Aksen etza seventi
A9: 9 | B9: of:=[.C9] -> nain | C9: nain | D9: of:=[.A9] -> 9 | E9: X*9=7X | F9: of:=[.E9] -> X*9=7X | G9: of:=[.H9] -> Aksen nainza seventi Aksen | H9: Aksen nainza seventi Aksen
A10: L | B10: of:=[.C10] -> ten | C10: ten | D10: of:=[.A10] -> L | E10: X*L=8Q | F10: of:=[.E10] -> X*L=8Q | G10: of:=[.H10] -> Aksen tenza etti kvelv | H10: Aksen tenza etti kvelv
A11: J | B11: of:=[.C11] -> zileven | C11: zileven | D11: of:=[.A11] -> J | E11: X*J=9L | F11: of:=[.E11] -> X*J=9L | G11: of:=[.H11] -> Aksen zilevenza nainti ten | H11: Aksen zilevenza nainti ten
A12: Q | B12: of:=[.C12] -> kvelv | C12: kvelv | D12: of:=[.A12] -> Q | E12: X*Q=L8 | F12: of:=[.E12] -> X*Q=L8 | G12: of:=[.H12] -> Aksen kvelvza tenti et | H12: Aksen kvelvza tenti et
A13: W | B13: of:=[.C13] -> dblun | C13: dblun | D13: of:=[.A13] -> W | E13: X*W=J6 | F13: of:=[.E13] -> X*W=J6 | G13: of:=[.H13] -> Aksen dblunza zileventi siks | H13: Aksen dblunza zileventi siks
A14: X | B14: of:=[.C14] -> Aksen | C14: Aksen | D14: of:=[.A14] -> X | E14: X*X=Q4 | F14: of:=[.E14] -> X*X=Q4 | G14: of:=[.H14] -> Aksen Aksenza kvelvti phor | H14: Aksen Aksenza kvelvti phor
A15: F | B15: of:=[.C15] -> phen | C15: phen | D15: of:=[.A15] -> F | E15: X*F=W2 | F15: of:=[.E15] -> X*F=W2 | G15: of:=[.H15] -> Aksen phenza dblunti tu | H15: Aksen phenza dblunti tu
A16: 10 | B16: of:=[.C16] -> vnti | C16: vnti | D16: of:=[.A16] -> 10 | E16: X*10=X0 | F16: of:=[.E16] -> X*10=X0 | G16: of:=[.H16] -> Aksen vntiza Aksenti | H16: Aksen vntiza Aksenti

Sheet: Ftebl
A1: 1 | B1: of:=[.C1] -> vn | C1: vn | D1: of:=[.A1] -> 1 | E1: F*1=F | F1: of:=[.E1] -> F*1=F | G1: of:=[.H1] -> phen vnza phen | H1: phen vnza phen
A2: 2 | B2: of:=[.C2] -> tu | C2: tu | D2: of:=[.A2] -> 2 | E2: F*2=1X | F2: of:=[.E2] -> F*2=1X | G2: of:=[.H2] -> phen tuza vnti Aksen | H2: phen tuza vnti Aksen
A3: 3 | B3: of:=[.C3] -> Thri | C3: Thri | D3: of:=[.A3] -> 3 | E3: F*3=2W | F3: of:=[.E3] -> F*3=2W | G3: of:=[.H3] -> phen Thriza tuti dblun | H3: phen Thriza tuti dblun
A4: 4 | B4: of:=[.C4] -> phor | C4: phor | D4: of:=[.A4] -> 4 | E4: F*4=3Q | F4: of:=[.E4] -> F*4=3Q | G4: of:=[.H4] -> phen phorza Thriti kvelv | H4: phen phorza Thriti kvelv
A5: 5 | B5: of:=[.C5] -> phaiv | C5: phaiv | D5: of:=[.A5] -> 5 | E5: F*5=4J | F5: of:=[.E5] -> F*5=4J | G5: of:=[.H5] -> phen phaivza phorti zileven | H5: phen phaivza phorti zileven
A6: 6 | B6: of:=[.C6] -> siks | C6: siks | D6: of:=[.A6] -> 6 | E6: F*6=5L | F6: of:=[.E6] -> F*6=5L | G6: of:=[.H6] -> phen siksza phaivti ten | H6: phen siksza phaivti ten
A7: 7 | B7: of:=[.C7] -> seven | C7: seven | D7: of:=[.A7] -> 7 | E7: F*7=69 | F7: of:=[.E7] -> F*7=69 | G7: of:=[.H7] -> phen sevenza siksti nain | H7: phen sevenza siksti nain
A8: 8 | B8: of:=[.C8] -> et | C8: et | D8: of:=[.A8] -> 8 | E8: F*8=78 | F8: of:=[.E8] -> F*8=78 | G8: of:=[.H8] -> phen etza seventi et | H8: phen etza seventi et
A9: 9 | B9: of:=[.C9] -> nain | C9: nain | D9: of:=[.A9] -> 9 | E9: F*9=87 | F9: of:=[.E9] -> F*9=87 | G9: of:=[.H9] -> phen nainza etti seven | H9: phen nainza etti seven
A10: L | B10: of:=[.C10] -> ten | C10: ten | D10: of:=[.A10] -> L | E10: F*L=96 | F10: of:=[.E10] -> F*L=96 | G10: of:=[.H10] -> phen tenza nainti siks | H10: phen tenza nainti siks
A11: J | B11: of:=[.C11] -> zileven | C11: zileven | D11: of:=[.A11] -> J | E11: F*J=L5 | F11: of:=[.E11] -> F*J=L5 | G11: of:=[.H11] -> phen zilevenza tenti phaiv | H11: phen zilevenza tenti phaiv
A12: Q | B12: of:=[.C12] -> kvelv | C12: kvelv | D12: of:=[.A12] -> Q | E12: F*Q=J4 | F12: of:=[.E12] -> F*Q=J4 | G12: of:=[.H12] -> phen kvelvza zileventi phor | H12: phen kvelvza zileventi phor
A13: W | B13: of:=[.C13] -> dblun | C13: dblun | D13: of:=[.A13] -> W | E13: F*W=Q3 | F13: of:=[.E13] -> F*W=Q3 | G13: of:=[.H13] -> phen dblunza kvelvti Thri | H13: phen dblunza kvelvti Thri
A14: X | B14: of:=[.C14] -> Aksen | C14: Aksen | D14: of:=[.A14] -> X | E14: F*X=W2 | F14: of:=[.E14] -> F*X=W2 | G14: of:=[.H14] -> phen Aksenza dblunti tu | H14: phen Aksenza dblunti tu
A15: F | B15: of:=[.C15] -> phen | C15: phen | D15: of:=[.A15] -> F | E15: F*F=X1 | F15: of:=[.E15] -> F*F=X1 | G15: of:=[.H15] -> phen phenza Aksenti vn | H15: phen phenza Aksenti vn
A16: 10 | B16: of:=[.C16] -> vnti | C16: vnti | D16: of:=[.A16] -> 10 | E16: F*10=F0 | F16: of:=[.E16] -> F*10=F0 | G16: of:=[.H16] -> phen vntiza phenti | H16: phen vntiza phenti